URL,Product Name,Product Description,Average Rating,Total Reviews
https://www.influenster.com/reviews/loreal-paris-color-radiance-more-than-shampoo,L'Oreal Paris Color Radiance More Than Shampoo,"Cleanses like a shampoo, cares like a mask. A shampoo with a mask-like texture ultra-concentrated in nutritive lipids. They assimilate instantly into the dry parts of the fibre for targeted care that remains, even when rinsed. Coloured hair is lastingly cleansed and intensely nourished with no weigh-down.",5 / 5,1506
https://www.influenster.com/reviews/dove-advanced-hair-series-oxygen-moisture-shampoo,Dove Advanced Hair Series Oxygen Moisture Shampoo,"Created for fine, flat and dry hair, Dove Nutritive Solutions Oxygen Moisture Shampoo helps to add volume – without weighing hair down.",4 / 5,1458
https://www.influenster.com/reviews/herbal-essences-biorenew-bourbon-manuka-honey-rejuvenating-shampoo-135-fl-oz,Herbal Essences Bio:Renew Bourbon Manuka Honey Rejuvenating Shampoo - 13.5 fl oz,"Rejuvenate dull, lifeless hair with Herbal Essences Bourbon Manuka Honey Shampoo. Our real botanicals are endorsed by Royal Botanic Gardens, Kew, a leading expert on plants. This rejuvenating shampoo, with real botanicals, restores moisture and softens hair from root to tip. Crafted with our signature blend of real botanicals, Bourbon Manuka Honey Shampoo helps moisturize and protect hair from damage and breakage. Color-safe and pH-balanced, this rejuvenating shampoo cleanses while infusing notes of honeyed plum, white florals and precious woods into your hairâ€”leaving it visibly strong and resilient. Lather, rinse and repeat with ease knowing your shampoo is paraben free, silicone free and colorant free, and made with at least 90% natural-origin ingredients.* *Purified water and natural-source ingredient materials with limited processing. REJUVENATE: Our Bourbon Manuka Honey Shampoo is specifically crafted to cleanse and rejuvenate hair REAL BOTANICALS ENDORSED BY KEW: The real botanicals in this formula have been endorsed by the Royal Botanic Gardens, Kew THE SCENT EXPERIENCE: Multilayered scents of honeyed plum, white florals and precious woods OUR NO, NO, NO LIST: Our Bourbon Manuka Honey Shampoo is paraben-free, silicone-free and colorant-free COLOR-SAFE & pH-BALANCED: Our color-safe and pH-balanced shampoos are crafted to be safe on color-treated hair",5 / 5,1451
https://www.influenster.com/reviews/loreal-paris-triple-resist-reinforcing-shampoo,L'Oreal Paris Triple Resist Reinforcing Shampoo,Triple Resist Reinforcing Shampoo,5 / 5,1434
https://www.influenster.com/reviews/sheamoisture-100-virgin-coconut-oil-daily-hydration-shampoo,SheaMoisture 100% Virgin Coconut Oil Daily Hydration Shampoo,"SheaMoisture Shampoo Coconut Oil - SheaMoisture Daily Hydration Shampoo Lift away impurities and re-hydrate hair with this gentle sulfate-free shampoo. Formulated with a nourishing blend of 100% Virgin Coconut and Shea Oils, our shampoo is the one you can count on for that wonderful clean and moisturized feeling. Coconut oil shampoo is great for hair growth because it contains ingredients that keeps hair hydrated, while helping to tame the frizz. Rich certified organic Shea Butter blends nicely with coconut oil, and we've also infused this shampoo with other natural moisturizers such as Argan Oil and Sweet Almond Oil. Coconut Milk and Acacia Senegal are also included to help provide renewed hydration, manageability and shine. Use daily or as often as desired for hair that bounces in the breeze.",5 / 5,1432
https://www.influenster.com/reviews/eva-nyc-clean-it-up-shampoo-pos,Eva NYC Clean It Up Shampoo,<!--td {border: 1px solid #ccc;}br {mso-data-placement:same-cell;}--> Hi There! Clean up on aisle hair! My foamy lather provides a refreshing clean on all hair types. My purifying shampoo formula removes product build-up for healthier-looking and touchably soft hair.,5 / 5,1415
https://www.influenster.com/reviews/tea-tree-lavender-mint-moisturizing-shampoo-sample,Tea Tree Lavender Mint Moisturizing Shampoo,,5 / 5,1408
https://www.influenster.com/reviews/tresemme-platinum-strength-strengthening-shampoo,TRESemmé Platinum Strength Strengthening Shampoo,"It starts with TRESemmé® Platinum Strength® Strengthening Shampoo, a salon shampoo, the first step designed to protect your hair from styling damage. When used in conjunction with TRESemmé® Platinum Strength® Conditioner, you'll even begin to repair and restore your hair from future harm after just five washes*. *In 5 uses when using TRESemmé® Platinum Strength® Shampoo and Conditioner as a system vs. non-conditioning shampoo.",4 / 5,1412
https://www.influenster.com/reviews/garnier-smoothing-conditioner-with-coconut-oil-cocoa-butter-extracts-64,Garnier Smoothing Conditioner with Coconut Oil & Cocoa Butter Extracts,Smoothing conditioner tames & controls frizzy hair,5 / 5,1415
https://www.influenster.com/reviews/finesse-restore-strengthen-moisturizing-shampoo-57,Finesse Restore + Strengthen Moisturizing Shampoo,"Get hair that’s healthier, stronger, and more alive with Finesse.   Finesse Restore + Strengthen Moisturizing Shampoo leaves dry, damaged, and stubborn hair feeling clean, silky soft, and more moisturized. Use for a restorative haircare experience where hair is stronger and more manageable.   This Finesse shampoo features a hair r",4 / 5,1407
https://www.influenster.com/reviews/cantu-shea-butter-for-natural-hair-sulfate-free-cleansing-cream-shampoo-3oz,Cantu Shea Butter for Natural Hair Sulfate-Free Cleansing Cream Shampoo 3oz,Cantu Shea Butter Cleansing Cream Shampoo can help you achieve the look that you want. It features shea butter to moisturize and soften your locks. This sulfate-free shampoo is gentle on strands to prevent wear or breakage. It comes in a bottle that is compliant with TSA regulations for easy travel. This product lathers up richly to lift and remove buildup from your hair so you get a natural and clean look.,4 / 5,1388
https://www.influenster.com/reviews/garnier-fructis-hydra-recharge-shampoo,Garnier Fructis Hydra Recharge Shampoo,"Hydra Recharge is the 1st shampoo with encapsulated beds of superfruit goji berry, plus passion fruit and kiwi fruit water*. Hair is ultra-hydrated, weightlessly silkier and softer.  Ingredients: Aqua/Water/Eau, Sodium Laureth Sulfate, Coco-Betaine, Acrylates Copolymer, Peg-30 Glyceryl Cocoate, Isopropyl Palmitate, Parfum/Fragrance, Peg-14 Dimethicone, Sodium Chloride, Sodium Hydroxide, Sodium Benzoate, Pyrus Malus Extract/Apple Fruit Extract, Disodium EDTA, Polyquaternium-39, Actinidia Chinensis Water / Kiwi Fruit Water, Niacinamide, Pyridoxine hcl , Hexylcinnamal , Citric Acid , Saccharum Of Ficina Rum Extract/ Sugar Cane Extract/Extrait De Canne A Sucre, Benzyl Alcohol, Linalool, Amyl Cinnamal, Passiflora Edulis Fruit Juice, Ci 77007/Ultr Amarines, Lycium Barbarum Fruit Extract, Methylchloroisothia Zolinone, Bisabolol, Methylisothiazolinone, Citrus Medica Limonum Peel Extract/Lemon Peel Extract, Camellia Sinensis Leaf Extract. F.I.L. D158393/3 Usage: Massage shampoo into wet hair, lather and rinse thoroughly. For best results, use with the Garnier Fructis Hydra Recharge Conditioner and Treatments.",5 / 5,1387
https://www.influenster.com/reviews/head-shoulders-instant-oil-control-shampoo,Head & Shoulders Instant Oil Control Shampoo,"- Head & Shoulders Instant Oil Control Anti-Dandruff Shampoo removes oil to leave your scalp clean and refreshed. - Multi-symptom relief offers proven protection from flakes, itch* and dryness. (*flakes and itch associated with dandruff) - Eliminates oil to relieve dandruff symptoms while cleansing and hydrating hair. - Bright mango and citrus essences leave hair smelling fresh and clean. - Clinically proven. Up to 100% dandruff protection.** ( **visible flakes, with regular use) Detailed information on Head & Shoulders ingredients",5 / 5,1382
https://www.influenster.com/reviews/fanola-no-yellow-shampoo-78,Fanola No Yellow Shampoo,"With time comes change, and hair is usually the first place we notice it. But don't stress any more if the grey streaks are setting in. Fanola has you covered with their line of No Yellow Shampoo. It's made with a violet pigment that turns down the grey or lightened hairs to be less noticeable. There's nothing wrong with going grey, but this No Yellow Shampoo helps you keep your color consistent and vibrant. It's an easy way to help time pass with a little more grace. FEATURES Ideal, for grey, super lightened, or decolored hair Violet pigment tones down unwanted yellow hues on grey, light blonde, or streaked hair",5 / 5,1355
https://www.influenster.com/reviews/mane-n-tail-shampoo-gallon-48,Mane 'n Tail® Shampoo Gallon,"The Original Mane ‘n Tail® Shampoo used by both people and horses, is an exclusive original formula that contains high lathering cleansing agents fortified with moisturizers and emollients. The micro-enriched protein formula provides ""down to the skin"" cleansing action and conditioning, leaving the hair soft and shiny.",4 / 5,1345
https://www.influenster.com/reviews/carols-daughter-wash-day-delight-sulfate-free-shampoo-with-rose-water,Carol's Daughter Wash Day Delight Sulfate Free Shampoo with Rose Water,Wash Day Delight Sulfate Free Shampoo with Rose Water,4 / 5,1343
https://www.influenster.com/reviews/nexxus-keraphix-shampoo-for-damaged-hair,Nexxus Keraphix Shampoo for Damaged Hair,"Gently cleanses and penetrates the hair fiber, starting the Keraphix damage healing process Infused with an exclusive PROTEINFUSION blend with Keratin Protein and Black Rice Salon quality shampoo is the first step to help heal visible signs of severe hair damage After one use, hair is stronger and visibly healthier when used with the full Keraphix system Silicone-free shampoo prepares hair for deep conditioning Continued use with Keraphix system enables restorative agents to increase the resilience of hair’s cortex",5 / 5,1340
https://www.influenster.com/reviews/function-of-beauty-wavy-hair-shampoo-base-with-fermented-rice-water-11-fl-oz,Function of Beauty Wavy Hair Shampoo Base with Fermented Rice Water - 11 fl oz,Customizable shampoo for wavy hair. Formulated with fermented rice water to strengthen and increase elasticity in wavy hair. Use on its own or mix in #HairGoal Booster Shots.,4 / 5,1341
https://www.influenster.com/reviews/ouai-detox-shampoo-10-oz-300-ml,OUAI Detox Shampoo 10 oz/ 300 mL,"A clarifying shampoo that cleanses away dirt, oil, and product buildup with apple cider vinegar and strengthens with keratin. Hair Type: Straight, Wavy, Curly, and CoilyHair Texture: Fine, Medium, and ThickKey Benefits: Clarifies and Cleanses, Removes Buildup, and Strengthens HairHair Concerns: Frizz, Shine, and Color SafeFormulation: LiquidIngredient Callouts: Free of sulfates SLS and SLES, parabens, formaldehydes, formaldehyde-releasing agents, phthalates, mineral oil, retinyl palmitate, oxybenzone, coal tar, hydroquinone, triclosan, and triclocarban. This product is also cruelty-free and gluten-free.",5 / 5,1367
https://www.influenster.com/reviews/pantene-pro-v-full-and-strong-shampoo,Pantene Pro-V Full and Strong Shampoo,"Seeking strong, thick hair? Show off your mane with Pantene Pro-V Full and Strong Shampoo. Fighting protein loss at the hair's core with a specially formulated PowerFULL antioxidant system, this shampoo strengthens against damage and brings out hair's natural fullness, all while gently cleansing. When paired with a Pantene Pro-V Full and Strong conditioner, you can further protect your strands against damage while achieving a full-looking head of hair. Ingredients: Water, Sodium Laureth Sulfate, Sodium Lauryl Sulfate, Glycol Distearate, Dimethicone, Cocamidopropyl Betaine, Sodium Citrate, Cocamide Mea, Sodium Xylenesulfonate, Fragrance, Citric Acid, Sodium Benzoate, Guar Hydroxypropyltrimonium Chloride, Sodium Chloride, Tetrasodium Edta, Trisodium Ethylenediamine Disuccinate, Panthenol, Panthenyl Ethyl Ether, Methylchloroisothiazolinone, Methylisothiazolinone",5 / 5,1330
https://www.influenster.com/reviews/ogx-extra-strength-biotin-collagen-shampoo-59,OGX Extra Strength Biotin & Collagen Shampoo,"OGX XS Biotin & Collagen Shampoo is a volume-creating powerhouse with an extra helping of vitamins and proteins to pump up flat strands. Extra body doesn’t mean extra weight with a thickening, sulfate-free surfactant blend of nourishing ingredients for full, voluminous hair. Biotin, or vitamin B7, is crucial for skin, nail, and hair health. Paired with collagen, this blend helps nourish hair for a full, healthy look. Be ready for a night out with extra strength conditioning designed to fill your strands with life and body. OGX XS helps provide more volume than regular strength shampoo, so show off those full strands! This premium ingredient blend infused with bamboo fiber extract and hydrolyzed wheat protein creates a color-safe plumping shampoo designed to nourish hair with everything it needs to look healthy and beautiful.",4 / 5,1314
https://www.influenster.com/reviews/redken-acidic-bonding-concentrate-shampoo-for-damaged-hair,Redken Acidic Bonding Concentrate Shampoo for Damaged Hair,"""Redken Acidic Bonding Concentrate Sulfate-Free Shampoo is Redken's most concentrated all-in-one formula for strength repair for all types of damaged hair. This ultra-rich and luxurious sulfate-free shampoo provides ultimate strength repair, intense conditioning and color fade protection.       Featuring Citric Acid, this shampoo contains a concentrated bonding care complex that reinforces weakened bonds within your hair to improve hair strength. This pH-balancing shampoo is specifically formulated with an acidic pH to defend against the negative effects of hair coloring, styling tools, and even water. The result? Hair that looks and feels healthy!      Key Benefits:            56% less breakage*      82% less visible split ends**      11x smoother hair***      pH balancing      For all hair types and textures      Ulimate repair, intense conditioning, and color fade protection      Citric Acid, an alpha hydroxy acid, which helps reinforce weakened bonds in the hair      * When used as a system of Acidic Bonding Concentrate Shampoo and Conditioner vs. non-conditioning shampoo (L’Oreal Product Test: Date: August 7, 2020)      ** When used as a system of Acidic Bonding Concentrate Shampoo, Conditioner and Leave-In Treatment vs. non-conditioning shampoo (L’Oreal Product Test :Date: August 6, 2020)  ***When used as a system of Acidic Bonding Concentrate Shampoo, Conditioner and Leave-In Treatment vs. non-conditioning shampoo (L’Oreal Product Test :Date: July 30th, 2020)""",5 / 5,1346
https://www.influenster.com/reviews/honest-shampoo-body-wash-everyday-gentle,Honest Shampoo + Body Wash - Everyday Gentle,"Gently cleanse your baby’s delicate scalp and sensitive skin with our best selling, gentle shampoo and nourishing body wash.",5 / 5,1283
https://www.influenster.com/reviews/moroccanoil-moisture-repair-shampoo-250ml,Moroccanoil Moisture Repair Shampoo,Moroccanoil Moisture Repair Shampoo 250mL,5 / 5,1287
https://www.influenster.com/reviews/gliss-kur-ultimate-repair-shampoo-250-ml-pack-of-1-,Gliss Kur Ultimate Repair shampoo 250 ml - Pack of 1-,1 per order Made in Germany Labeled: German,5 / 5,1272
https://www.influenster.com/reviews/suave-sleek-smooth-shampoo,Suave Sleek & Smooth Shampoo,"Transforma tu cabello seco o con frizz en un estilo liso, de aspecto saludable y elegante con nuestro champú humectante Sleek & Smooth Shampoo.",5 / 5,1253
https://www.influenster.com/reviews/tresemme-shampoo-vitamin-c-deep-cleansing,TRESemmé Shampoo Vitamin - C Deep Cleansing,"Professional formula. Removes build-up & pollutants. Professional performance formula removes build-up and pollutants. Gentle enough for every day use. Infused with Vitamin C, Grapefruit and Lemon Peel Extracts.",5 / 5,1249
https://www.influenster.com/reviews/loreal-paris-smooth-intense-smoothing-shampoo,L'Oreal Paris Smooth Intense Smoothing Shampoo,Smooth Intense Smoothing Shampoo,5 / 5,1244
https://www.influenster.com/reviews/head-shoulders-pure-and-gentle-shampoo,Head & Shoulders Pure and Gentle Shampoo,Pure and Gentle Shampoo,5 / 5,1244
https://www.influenster.com/reviews/head-shoulders-tea-tree-mint-complex-shampoo,Head & Shoulders Tea Tree + Mint Complex Shampoo,"- Head & Shoulders Tea Tree + Mint Complex Dandruff Shampoo fights flakes and invigorates scalp - Tea Tree + Mint Dandruff Shampoo has the refreshing scent of tea tree and mint - Intensely moistuized, up to 100% flake free* hair (*visible flakes; with regular use)",4 / 5,1233
https://www.influenster.com/reviews/aussie-miracle-curls-shampoo,Aussie Miracle Curls Shampoo,Perfect for curly hair in need of a miracle. â€¢ Moisturize â€¢ Soften â€¢ Gently Cleanses,5 / 5,1228
https://www.influenster.com/reviews/garnier-damage-repairing-treat-shampoo-papaya-extract,Garnier Damage Repairing Treat Shampoo + Papaya Extract,"PRODUCT INFORMATION   What’s your hair care made of? New Fructis Treats Shampoos & Conditioners made with 98% naturally derived ingredients, bursting with super fruits, made to nourish hungry hair. Fructis Treats say YES to Papaya Extract, NO to Silicones, YES to Nourish, NO to Parabens, YES to Vegan Formula with no animal derived ingredients. All in a recyclable bottle for just soft, nourished, shiny hair. Hungry for more? Try our Treats Hair Mask, 3 Ways to Enjoy: 1. Hair Mask 2. Conditioner 3. Leave in Treatment. By Garnier Naturally.  Garnier Fructis Damage Repairing Treat Shampoo with Papaya Extract is made with 98% naturally derived ingredients. Cleanse, nourish and fight damage for dry, damaged hair. No silicones, no parabens, no artificial colorants, vegan formula with no animal derived ingredients.  *We consider an ingredient to be naturally derived if it is unchanged from its natural state or has undergone processing yet still retains greater than 50% of its molecular structure from its original plant or mineral source. This formula consists of 98% naturally derived ingredients. The remaining ingredients constitute 2% of the formula to ensure sensoriality and preservation.",5 / 5,1205
https://www.influenster.com/reviews/garnier-smoothing-oil-with-coconut-oil-cocoa-butter-extracts,Garnier Smoothing Oil with Coconut Oil & Cocoa Butter Extracts,Deeply smoothes & helps eliminate frizz & flyaways,5 / 5,1194
https://www.influenster.com/reviews/garnier-hydrating-treat-shampoo-aloe-extract-88,Garnier Hydrating Treat Shampoo + Aloe Extract,"What’s your hair care made of? New Fructis Treats Shampoos & Conditioners made with 98% naturally derived ingredients, bursting with super fruits, made to nourish hungry hair. Fructis Treats say YES to Aloe Extract, NO to Silicones, YES to Nourish, NO to Parabens, YES to Vegan Formula with no animal derived ingredients. All in a recyclable bottle for just soft, nourished, shiny hair. Hungry for more? Try our Treats Hair Mask, 3 Ways to Enjoy: 1. Hair Mask 2. Conditioner 3. Leave in Treatment. By Garnier Naturally. Garnier Fructis Hydrating Treat Shampoo with Aloe Extract is made with 98% naturally derived ingredients. Cleanse, nourish and hydrate for normal hair. No silicones, no parabens, no artificial colorants, vegan formula with no animal derived ingredients. *We consider an ingredient to be naturally derived if it is unchanged from its natural state or has undergone processing yet still retains greater than 50% of its molecular structure from its original plant or mineral source. This formula consists of 98% naturally derived ingredients. The remaining ingredients constitute 2% of the formula to ensure sensoriality and preservation.",5 / 5,1185
https://www.influenster.com/reviews/pantene-pantene-pro-v-damage-detox-scalp-care-shampoo,Pantene Pantene Pro-V Damage Detox Scalp Care Shampoo,Damage Detox Scalp Care Shampoo,5 / 5,1184
https://www.influenster.com/reviews/suave-coconut-oil-infusion-shampoo-50,Suave Coconut Oil Infusion Shampoo,"Champú Coconut Oil Infusion Shampoo para cabello dañado, enriquecido con aceite de coco puro, repara visiblemente el daño de dos años.",5 / 5,1181
https://www.influenster.com/reviews/pantene-expert-pro-v-intense-hydration-shampoo,Pantene Expert Pro-V Intense Hydration Shampoo,"INTENSE MOISTURE * INSTANT SOFTNESS Chronic dryness doesn't only affect how hair feels. When hair loses its moisture, it becomes duller, more unmanageable, and vulnerable to breakage. Our most intensely concentrated formula works to instantly quench hair with moisture without weighing it down.  USAGE: WHO: Specially crafted for those who seek an exceptional level of care to treat their dry hair.  Gentle enough for those who color. WHEN: Daily to hydrate, soften, and nourish. HOW: Massage into hair and work into a rich lather. Rinse. Follow with Intense Hydration Conditioner. Ingredients: water, sodium laureth sulfate, sodium chloride, sodium citrate, cocamidopropyl betaine, stearyl alcohol, fragrance, ammonium lauryl sulfate, cetyl alcohol, glycerin, dimethiconol, sodium xylenesulfonate, guar hydroxypropyltrimonium chloride, dimethicone, sodium benzoate, citric acid, tea-dodecylbenzenesulfonate, tetrasodium edta, trisodium ethylenediamine disuccinate, trihydroxystearin, trideceth-10, polyquaternium-6, polyquaternium-10, panthenol, panthenyl ethyl ether, yellow 5, methylchloroisothiazolinone, methylisothiazolinone, red 33, blue 1.",4 / 5,1178
https://www.influenster.com/reviews/garnier-fructis-fortifying-shampoo-for-dry-or-damaged-hair,Garnier Fructis Fortifying Shampoo For Dry or Damaged Hair,"Shampoo is used to eliminate dryness and bring up soft strands, relieve the scalp irritation, eliminate dandruff, leaving your strands 100% flake-free and keeps hair beautiful.",4 / 5,1176
https://www.influenster.com/reviews/loreal-paris-everpure-repair-defend-shampoo,L'Oréal Paris EverPure Repair & Defend Shampoo,"Deeply Strengthens. Anti-Fade. Protects from Color Aggressors. Formulated with Goji. EverPure Repair & Defend Shampoo with Goji makes hair 3X stronger as it defends against damage and daily color aggressors. UV rays, water and heat styling can sensitize hair and affect your color. Color-treated hair requires special care. Our shampoo is especially gentle on color. There are no harsh sulfates, salts or surfactants that can strip, dull and damage hair. Experience a purely sensorial lush, luxurious lather and a fresh aromatic fragrance that blooms. Ever, our original 100% sulfate-free haircare. Pure respect for your hair. Ingredients: Aqua / Water / EAU Sodium Cocoyl Isethionate Disodium Laureth Sulfosuccinate Sodium Lauryl Sulfoacetate Sodium Lauroyl Sarcosinate Coco-betaine Glycol Distearate Glycereth-26 Decyl Glucoside Parfum / Fragrance Sodium Isethionate Coconut Acid Ppg-5-ceteth-20 Sodium Chloride Divinyldimethicone/Dimethicone Copolymer Polyquaternium-7 Amodimethicone Carbomer Acrylates Copolymer Polyquaternium-10 Peg-55 Propylene Glycol Oleate Propylene Glycol C11-15 Pareth-7 Benzoic Acid Lycium Barbarum Fruit Extract Ethylhexyl Methoxycinnamate Benzyl Salicylate Laureth-9 Hexyl Cinnamal Glycerin Benzyl Alcohol Linalool Hexadimethrine Chloride Trideceth-12 Limonene Euterpe Oleracea Fruit Extract Sodium Benzoate Magnesium Nitrate C12-13 Pareth-23 C12-13 Pareth-3 2-oleamido-1,3-octadecanediol Phenoxyethanol Maltodextrin Sodium Acetate Salicylic Acid Isopropyl Alcohol Methylchloroisothiazolinone Sorbic Acid Magnesium Chloride Methylisothiazolinone BHT Sodium Hydroxide Citric Acid",4 / 5,1169
https://www.influenster.com/reviews/head-shoulders-mens-refreshing-menthol-anti-dandruff-shampoo,Head & Shoulders Men's Refreshing Menthol Anti-Dandruff Shampoo,"Head & Shoulders Refreshing Menthol Anti-Dandruff Shampoo fights flakes and leaves your scalp clean and refreshed Multi-symptom relief offers proven protection from flakes, itch* and dryness (*flakes and itch associated with dandruff) Anti-dandruff formula with menthol soothes dry, itchy scalp Clinically proven. Up to 100% dandruff protection.** ( **visible flakes, with regular use)",4 / 5,1151
https://www.influenster.com/reviews/herbal-essences-biorenew-sheer-moisture-cucumber-green-tea-shampoo-135-fl-oz,Herbal Essences Bio:Renew Sheer Moisture Cucumber & Green Tea Shampoo - 13.5 fl oz,"Cleanse & lightly moisturize dry, lifeless hair with Herbal Essences Cucumber & Green Tea Shampoo. Our real botanicals are endorsed by Royal Botanic Gardens, Kew, a leading expert on plants. This shampoo, with real botanicals, cleans and softens hair from root to tip. Crafted with our signature blend of real botanicals, Cucumber & Green Tea Shampoo helps cleanse for smooth, beautiful hair. Color-safe and pH-balanced, this shampoo cleanses while infusing notes of green tea leaves, water lily and clean amber into your hairâ€”leaving it beautiful and moisturized. Lather, rinse and repeat with ease knowing your shampoo is paraben free and colorant free, and made with at least 90% natural-origin ingredients.* *Purified water and natural-source ingredient materials with limited processing. CLEANSE & LIGHTLY MOISTURIZE: Our Cucumber & Green Tea Shampoo is crafted to cleanse and lightly moisturize hair REAL BOTANICALS ENDORSED BY KEW: The real botanicals in this formula have been endorsed by the Royal Botanic Gardens, Kew THE SCENT EXPERIENCE: Multilayered scents of green tea leaves, water lily and clean amber OUR NO, NO, NO LIST: Our Cucumber & Green Tea Shampoo is paraben-free and colorant-free COLOR-SAFE & pH-BALANCED: Our color-safe and pH-balanced shampoos are crafted to be safe on color-treated hair",2 / 5,1145
https://www.influenster.com/reviews/tresemme-pro-pure-damage-shampoo,TRESemmé Pro Pure Damage Shampoo,TRESemmé® Pro Pure Damage Shampoo is a sulfate and paraben free formula that removes impurities while protecting hair from damage.,4 / 5,1143
