URL,Product Name,Product Description,Average Rating,Total Reviews
https://www.influenster.com/reviews/pantene-pro-v-beautiful-lengths-shampoo,Pantene Pro-V Beautiful Lengths Shampoo,"Shampoo cleanses and fortifies strands against breakage so you can grow hair as long as you want. Longer. Stronger. Faster. Cleanse and nourish your strands while fortifying against breakage so you can grow your hair longer. Clinically Proven Healthier Hair with Every Wash. USAGE: WHO: Great for longer hair that is prone to premature breakage. Gentle enough for chemically relaxed, pressed, or natural African-American hair. WHEN: Daily, to give hair a dose of nourishment HOW: Lather into wet hair; repeat if you want to. Follow with Beautiful Lengths Conditioner for moisturized, beautiful hair. Ingredients Water, Sodium Lauryl Sulfate, Sodium Laureth Sulfate, Cocamidopropyl Betaine, Glycol Distearate, Dimethicone, Sodium Citrate, Cocamide Mea, Sodium Xylenesulfonate, Fragrance, Citric Acid, Sodium Benzoate, Polyquaternium-76, Sodium Chloride, Tetrasodium Edta, Trisodium Ethylenediamine Disuccinate, Panthenol, Panthenyl Ethyl Ether, Methylchloroisothiazolinone, Methylisothiazolinone",5 / 5,2421
https://www.influenster.com/reviews/mbib-gold-series-moisture-boost-shampoo,Mbib Gold Series Moisture Boost Shampoo,Gold Series Moisture Boost Shampoo,5 / 5,2369
https://www.influenster.com/reviews/african-black-soap-bentonite-clay-shampoo-bar,African Black Soap Bentonite Clay Shampoo Bar,"A completely new experience for hair! This mineral-rich shampoo bar absorbs excess oils and lifts away impurities while providing a gentle cleansing, rich lather. Unique curved edges make direct application to root and scalp easy. African Black Soap blends with Bentonite Clay, eliminating dirt and impurities to help sooth irritated scalp conditions. Format is ideal for travel.",3 / 5,2332
https://www.influenster.com/reviews/loreal-paris-fibralogy-shampoo-and-conditioner,L'Oréal Paris Fibralogy Shampoo and Conditioner,"A new science for hair fibre is born.  L’Oreal Paris Fibralogy haircare thickens hair wash after wash, and expands the diameter of the hair fibre for voluptuous-looking hair! Our breakthrough thickening haircare contains filloxane, an innovative molecule that penetrates the fibre and helps increase its diameter from within. Hair is thicker and feels fuller.",4 / 5,2308
https://www.influenster.com/reviews/nanoworks-gold-shampoo,Nanoworks Gold Shampoo,"Rich, transformative shampoo that renews softness, manageability, and shine to cleanse dull, aging color-treated hair.",5 / 5,2287
https://www.influenster.com/reviews/nexxus-therappe-ultimate-moisture-shampoo-for-normal-to-dry-hair,Nexxus Therappe Ultimate Moisture Shampoo for Normal to Dry Hair,Step 1: Shampoo (5.1 oz) for normal to dry hair replenishes hair fiber for Ultimate Moisture Salon crafted with Caviar & Protein Complex for 24-hour moisture Salon quality shampoo uses silicone-free formula Locks in moisture to unleash hair’s smoothness Treats hair with rehydrating essential nutrients and retains natural movement Helps restore flexibility to normal to dry hair,4 / 5,2275
https://www.influenster.com/reviews/dove-dryness-itch-relief-anti-dandruff-shampoo,Dove Dryness & Itch Relief Anti-Dandruff Shampoo,The solution that nourishes the scalp and relieves it from Irritation,4 / 5,2258
https://www.influenster.com/reviews/mane-n-tail-daily-control-anti-dandruff-shampoo-16-oz-31,Mane 'n Tail® Daily Control Anti-Dandruff Shampoo 16 oz.,Mane 'n Tail® Daily Control Anti-Dandruff shampoo helps prevent recurrence of flaking and itching associated with dandruff. For best results follow with Mane 'n Tail® Daily Control Anti-Dandruff Conditioner.,5 / 5,2240
https://www.influenster.com/reviews/strength-cure-blonde-shampoo,Strength Cure Blonde Shampoo,Deep purple shampoo that tones down brassiness and strengthens damaged hair.,5 / 5,2230
https://www.influenster.com/reviews/herbal-essences-argan-oil-of-morocco-shampoo,Herbal Essences Argan Oil Of Morocco Shampoo,"Repair Hair for Smoothness Herbal Essences Argan Oil of Morocco Shampoo is a specifically crafted shampoo for damaged hair, with naturally inspired ingredients to repair. Crafted with bio:renew, a signature blend of essential antioxidants, aloe and sea kelp Herbal Essences Argan Oil of Morocco shampoo with bio:renew brings your hair back to life in just 21 days Argan Oil of Morocco Shampoo has 0% parabens, gluten and colorants Shampoo that is color safe, nurtures and repairs hair Experience the multi-layered scents of fizzy citrus, exotic spices and creamy vanilla of Herbal Essences Argan Oil of Morocco shampoo For more stunning hair, use Argan Oil of Morocco Conditioner and Oil-Infused Crème with bio:renew Ingredients :  Water/Eau, Sodium Lauryl Sulfate, Sodium Laureth Sulfate, Cocamidopropyl Betaine, Glycol Distearate, Dimethicone, Fragrance/Parfum, Argania Spinosa Kernel Oil, Histidine, Aloe Barbadensis Leaf Juice, Ecklonia Radiata Extract, Sodium Citrate, Cocamide Mea, Sodium Xylenesulfonate, Citric Acid, Sodium Benzoate, Sodium Chloride, Guar Hydroxypropyltrimonium Chloride, Tetrasodium Edta, Polyquaternium-6, Methylchloroisothiazolinone, Methylisothiazolinone.",5 / 5,2188
https://www.influenster.com/reviews/redken-color-extend-magnetics-shampoo-300ml-47,Redken Color Extend Magnetics Shampoo 300mL,Redken Color Extend Magnetics Shampoo 300mL,5 / 5,2173
https://www.influenster.com/reviews/nexxus-color-assure-shampoo-for-colored-hair,Nexxus Color Assure Shampoo for Colored Hair,"Step 1: Color protecting shampoo (13.5 oz) replenishes nutrients for Vibrancy Retention Enriched with White Orchid Extract Salon shampoo follows on from Pre-Wash Primer, cleansing and nourishing hair Locks in color vibrancy and leaves hair radiant Color safe shampoo helps hair retain natural movement Designed for colored hair and infused with a conditioning polymer",5 / 5,2165
https://www.influenster.com/reviews/dove-nutritive-solutions-color-care-shampoo,Dove Nutritive Solutions Color Care Shampoo,"Created for colored hair, Dove Color Care Shampoo and Conditioner keeps your color vibrant for up to 8 weeks.",5 / 5,2115
https://www.influenster.com/reviews/maui-moisture-heal-hydrate-shea-butter-shampoo-10,Maui Moisture Heal & Hydrate + Shea Butter Shampoo,"Creamy shea butter is whipped into this hydrating shampoo blend along with rich coconut and macadamia oils help deeply quench, nourish, and soften strands to get your hair back to looking healthy.",1 / 5,2119
https://www.influenster.com/reviews/matrix-so-silver-color-depositing-purple-shampoo-for-blonde-and-silver-hair,Matrix So Silver Color Depositing Purple Shampoo for Blonde and Silver Hair,Color depositing purple shampoo for neutralizing warmth and correcting yellow tones in blonde and grey hair.,3 / 5,2084
https://www.influenster.com/reviews/pantene-pro-v-advanced-care-shampoo,Pantene Pro-V Advanced Care Shampoo,"Find it at Costco. Elevate your hair care with Pantene Pro-V Advanced Care Shampoo. This new Pantene system is infused with a Vitamin B5 Complex that reduces protein loss so your hair stays strong against damage. It’s also packed with 5 solutions including moisture, strength against damage, smoothness, color protection and damage repair that are noticeable from the very first wash. USAGE: WHO: For all hair types seeking advanced technology to meet multiple needs. WHEN: Use daily for best results. HOW: Lather into wet hair; repeat if you want to. Ingredients: Water, Sodium Laureth Sulfate, Sodium Lauryl Sulfate, Cocamidopropyl Betaine, Glycol Distearate, Sodium Xylenesulfonate, Fragrance, Dimethiconol, Dimethicone, Citric Acid, Sodium Benzoate, Guar Hydroxypropyltrimonium Chloride, Sodium Chloride, Tea-Dodecylbenzenesulfonate, Tetrasodium Edta, Trideceth-10, Trisodium Ethylenediamine Disuccinate, Panthenol, Panthenyl Ethyl Ether, Tocopheryl Acetate, Methylchloroisothiazolinone, Methylisothiazolinone.",5 / 5,2078
https://www.influenster.com/reviews/ogx-beauty-teatree-mint-shampoo,Ogx Beauty Teatree Mint Shampoo,"Re-energize your hair with this blend of active ingredients. Australian tea tree oils, milk proteins and micro-infused peppermint help to strengthen and moisturize while bringing balance to your scalp. A three-in-one treat in one refreshing formula.",5 / 5,2029
https://www.influenster.com/reviews/loreal-paris-sulfate-free-blonde-shampoo-with-iris,L'Oreal Paris Sulfate Free Blonde Shampoo with Iris,Sulfate Free Blonde Shampoo with Iris,3 / 5,1978
https://www.influenster.com/reviews/pantene-nutrient-blends-miracle-moisture-boost-rose-water-shampoo-for-dry-hair-sulfate-free-36,"Pantene Nutrient Blends Miracle Moisture Boost Rose Water Shampoo for Dry Hair, Sulfate Free","Luxurious formula hydrates parched locks to leave them smooth and soft. 0% sulfates, parabens, dyes and mineral oil.",3 / 5,2118
https://www.influenster.com/reviews/redken-extreme-shampoo-73,Redken Extreme Shampoo,Redken Extreme Shampoo 300mL,5 / 5,1963
https://www.influenster.com/reviews/ogx-anti-breakage-keratin-oil-shampoo-130-fl-ozpack-of-1,OGX Anti-Breakage Keratin Oil Shampoo 13.0 fl oz(pack of 1),"John Frieda Colour Refreshing Gloss Weekly Salon Treatment, Warm Reds 6.0 fl oz(pack of 4)",4 / 5,1938
https://www.influenster.com/reviews/tresemme-split-remedytm-shampoo,TRESemmé Split Remedy™ Shampoo,"Put split ends in their place with TRESemmé Split Remedy Shampoo. This split ends shampoo gently cleanses and moisturizes, so hair is healthy looking and manageable, while reducing split ends up to 80% after just three uses*. The innovative Reconstructing Complex® binds split ends, and with continued use, can fix damage as it occurs.",5 / 5,1925
https://www.influenster.com/reviews/john-frieda-go-blonder-lightening-shampoo,John Frieda Go Blonder® Lightening Shampoo,Go Blonder® Lightening Shampoo,5 / 5,1921
https://www.influenster.com/reviews/tresemme-botanique-damage-recovery-shampoo-for-damaged-hair-88,TRESemmé Botanique Damage Recovery Shampoo for Damaged Hair,"Si tu cabello ha pasado por mucho, TRESemmé Botanique Damage Recovery System es el tratamiento que necesita. Con infusión de aceite de macadamia, proteínas de trigo y aguacate, nuestro champú fortalece y repara el cabello con cada lavado. Fragancia: Una fragancia cremosa y exquisita de frutas suaves y vainilla joven.",4 / 5,1919
https://www.influenster.com/reviews/herbal-essences-long-term-relationship-shampoo-for-long-hair-59,Herbal Essences Long Term Relationship Shampoo For Long Hair,"Herbal Essences Long Term Relationship Shampoo for long hair lavishes every inch of your hair with 10X keratin protection*, defending against damage and leaving it oh-so luscious. *protection against damage vs. non-conditioning shampoo Herbal Essences Long Term Relationship Shampoo is lovingly free of parabens, gluten, and mineral oilInfused with Pomegranate Essences Helps repair damage and smoothes texture so hair grows long & strong A hydration fix that’s hair-flip-worthy Color-safe, pH-balanced formula Ingrédients :  Water/Eau, Sodium Lauryl Sulfate, Sodium Laureth Sulfate, Cocamidopropyl Betaine, Glycol Distearate, Punica Granatum Extract, Butyrospermum Parkii (Shea) Butter Extract, Fragrance/Parfum, Sodium Citrate, Cocamide Mea, Sodium Xylenesulfonate, Dimethicone, Citric Acid, Sodium Benzoate, Polyquaternium-76, Sodium Chloride, Tetrasodium Edta, Trisodium Ethylenediamine Disuccinate, Red 33, Methylchloroisothiazolinone, Methylisothiazolinone, Blue 1.",5 / 5,1913
https://www.influenster.com/reviews/tresemme-tres-smooth-and-silky-touchable-softness-shampoo,TRESemmé Tres Smooth and Silky Touchable Softness Shampoo,"For moisturizing relief that won’t weigh your hair down, start your day with TRESemmé® Smooth & Silky Touchable Softness Shampoo. Part of a complete shine and moisture system, this TRESemmé® shampoo cleans away dirt, oil, and other products and offers advanced defense against frizz and flyways, keeping your style salon-soft and touchable.",5 / 5,1878
https://www.influenster.com/reviews/big-sexyhair-volumizing-shampoo-338oz,Big SexyHair Volumizing Shampoo,Sexy Hair Volumizing Shampoo 33.8 Ounce,2 / 5,1847
https://www.influenster.com/reviews/love-beauty-and-planet-sulfate-free-murumuru-butter-rose-shampoo,Love Beauty And Planet sulfate-free murumuru butter & rose shampoo,Keep your color-treated hair vibrant with Love Beauty and Planet® Blooming Color Murumuru Butter & Rose Sulfate-Free Shampoo.,5 / 5,1828
https://www.influenster.com/reviews/ogx-beauty-coconut-curls-shampoo,Ogx Beauty Coconut Curls Shampoo,"Curls look better when they’re quenched. So treat your tresses to this nourishing and frizz-taming tropical blend, with coconut oil, sweet honey and citrus oil, for hair that’s as beautiful as it is bouncy.",5 / 5,1815
https://www.influenster.com/reviews/not-your-mothers-beach-babe-moisturizing-shampoo-conditioner,Not Your Mother's® Beach Babe Moisturizing Shampoo,"Beach Babe Moisturizing Shampoo We know you want sexy, windswept hair – and you can’t get enough of your NYM addiction (*wink*) – but you’re still craving that extra something? Then use Beach Babe Moisturizing Shampoo as the perfect base to create those tousled waves with ease. Hang loose, because this salon formula, infused with sea kelp and coconut oil, will cleanse your hair without harsh sulfates and leave you feeling (and smelling!) like you just got to the shore!   Beach Babe Moisturizing Conditioner We know you want sexy, windswept hair – and you can’t get enough of your NYM addiction (*wink*) – but you’re still craving that extra something? Then use Beach Babe Moisturizing Conditioner as the perfect base to create moisturized, healthy waves with ease. Hang loose, because this salon formula, infused with sea kelp and coconut oil, will nourish and soften your hair and leave you feeling (and smelling!) like you just got to the shore! MSRP: $2 each (travel-size)",5 / 5,1748
https://www.influenster.com/reviews/biolage-colorlast-shampoo-conditioner-338-oz-with-pumps,Biolage ColorLast Shampoo & Conditioner 33.8 Oz With pumps,"Bundle-4 Items : Matrix Biolage ColorLast Shampoo and Conditioner 33.8 Oz Set & 2 liter pumps : Color-treated hair often loses it's color and luster over time. Inspired by nature's fade-defying orchid, Biolage Colorlast Conditioner helps maintain the color depth, tone and shine for vivid color-treated hair. Give her hair salon-vibrant color for up to 9 weeks*. Color-treated hair can fade and lose it's luster over time. Inspired by nature's fade-defying orchid, Biolage Colorlast Shampoo helps maintain the color depth, tone and shine for vivid color-treated hair. Give her hair salon-vibrant color for up to 9 weeks*. (*When using the system of Colorlast shampoo and conditioner vs. a non-conditioning shampoo.) Forget about de-saturated color. These state of the art formulas, inspired by nature, help protect hair, balance moisture and even out the hair's surface for saturated, shiny, vibrant color that stays truer. This pump is designed to fit the new style of Matrix & Biolage 33.8 oz / liter bottles of shampoo and conditioner. Please note that that these pumps for for the new style bottles and will not fit the old wide mouth bottles. Bundle-4 Items - Matrix Biolage ColorLast Shampoo and Conditioner 33.8 Oz Set & 2 liter pumps; Matrix Biolage COLORLAST Shampoo and Conditioner Liter Duo (33.8 oz each); Works with the newer Matrix, Biolage, Sleek, Color Care, Curl, Amplify Liter Bottles",5 / 5,1724
https://www.influenster.com/reviews/lush-shampoo-bar,LUSH Shampoo Bar,"When stress or life goes to your head and your hair starts thinning, motivate your tired scalp with stimulating clove and cinnamon oils and a peppermint infusion. This spicy bar also has rosemary and nettles to soothe irritated scalps and make your hair shiny and soft. With a special #BeCrueltyFree message, our bestselling New encourages everyone to join the conversation about ending animal testing once and for all. Visit our friends at Humane Society International to learn more and take action. How to use: Rub between hands to create a lather, or directly onto hair. Massage into the hair and scalp then rinse clean ingredients Sodium Laureth Sulfate Nettle and Peppermint Infusion (Urtica dioica, Mentha piperita) Fragrance *Eugenol Glycerine Nettle Absolute (Urtica urens) Rosemary Absolute (Rosmarinus officinalis) Clove Bud Oil (Eugenia Caryophyllus) Cinnamon Leaf Oil (Cinnamomum Zeylanicum) *Cinnamal Cinnamyl Alcohol *Benzyl Benzoate *Limonene *Linalool Red 30 *Occurs naturally in essential oils",5 / 5,1714
https://www.influenster.com/reviews/devacurl-no-poo-cleanser-12-fl-oz,DevaCurl No-Poo Cleanser - 12 fl oz,"Which hair type is it good for? Curly A zero lather conditioning cleanser that gives your curls a dose of essential moisture. Key benefits: - Gently cleanses the scalp - Provides essential moisture - Adds shine If you want to know more… Keep hair healthy-looking and hydrated with the original, bestselling No-Poo® Zero Lather Conditioning Cleanser. This moisturizing, non-lathering formula with peppermint and grapeseed oil stimulates and cleans the scalp and hair without stripping away the natural oils your curls need. Hair is left shiny, bouncy, and beautiful. It is formulated Without: - Parabens - Sulfates This product is silicone-free.",5 / 5,1674
https://www.influenster.com/reviews/ogx-beauty-coconut-miracle-oil-shampoo,Ogx Beauty Coconut Miracle Oil Shampoo,"Create an island girl escape in your shower with this ultra-moisturizing formula for thick to coarse hair. Help repair, soften and revive damaged strands and discover silky, soft island-inspired hair.",5 / 5,1663
https://www.influenster.com/reviews/olaplex-no-4-bond-maintenancetm-shampoo-mini-33-oz-100-ml,Olaplex No. 4 Bond Maintenance(TM) Shampoo Mini 3.3 oz/ 100 mL,"Which hair type is it good for? Straight Wavy Curly Coiled Tightly Coiled A highly moisturizing, reparative shampoo that leaves hair easy to manage, shiny, and healthier with each use. Key benefits: - Repairs and maintains bonds within the hair - Eliminates frizz and flyaways - Reduces breakage If you want to know more… This shampoo repairs and protects hair from everyday stresses including damaged hair, split ends, and frizz by re-linking broken bonds. No.4 is color-safe and proven to reduce breakage and strengthen all types of hair. It is formulated Without: - Parabens - Sulfates - Phthalates",5 / 5,1683
https://www.influenster.com/reviews/suave-essentials-daily-clarifying-shampoo-37,Suave Essentials Daily Clarifying Shampoo,Descubre nuestro champú Daily Clarifying Shampoo para limpieza profunda y con pH equilibrado. Esta fórmula revitaliza y reconstituye la belleza natural de tu cabello.,5 / 5,1656
https://www.influenster.com/reviews/pantene-pro-v-truly-natural-co-wash-cleansing-conditioner,Pantene Pro-V Truly Natural Co-Wash Cleansing Conditioner,"Low-lather co-wash gently cleanses and conditions without stripping hair's natural moisture. Cleanses, conditions, & detangles in 1 easy step without stripping the hair's natural moisture Give your hair the 1-2-3 treatment, in just one wash. Clean, detangle, and condition without stripping your hair's natural moisture. USAGE: WHO: Gentle enough for color-treated hair WHEN: Use between shampoos to add shine and softness. HOW: 3in1 formula instantly cleanses, conditions, and detangles in one easy step without stripping hair’s natural moisture. Ingredients Water, Stearyl Alcohol, Cetyl Alcohol, Stearamidopropyl Dimethylamine, Glutamic Acid, Bis-Aminopropyl Dimethicone, Fragrance, Benzyl Alcohol, EDTA, Citric Acid, Sodium Chloride, Panthenol, Panthenyl Ethyl Ether, Simmondsia Chinensis (Jojoba) Seed Oil, Cocos Nucifera (Coconut) Oil, Methylchloroisothiazolinone, Methylisothiazolinone.",5 / 5,1650
https://www.influenster.com/reviews/oribe-gold-lust-repair-and-restore-shampoo,Oribe Gold Lust Repair And Restore Shampoo,Shop Oribe Gold Lust Repair and Restore Shampoo. Enjoy free shipping and free returns plus a free gift and 3 free samples with every purchase at Bluemercury.com.,5 / 5,1634
https://www.influenster.com/reviews/garnier-nourishing-shampoo-with-avocado-oil-shea-butter-extracts,Garnier Nourishing Shampoo with Avocado Oil & Shea Butter Extracts,Nourishing Shampoo Deeply replenishes & restores,5 / 5,1635
https://www.influenster.com/reviews/head-shoulders-citrus-breeze-shampoo,Head & Shoulders Citrus Breeze Shampoo,Citrus Breeze Shampoo,5 / 5,1627
https://www.influenster.com/reviews/garnier-smoothing-leave-in-conditioner-with-coconut-oil-cocoa-butter-extracts,Garnier Smoothing Leave-In Conditioner with Coconut Oil & Cocoa Butter Extracts,Deeply nourishes to smooth & soften frizzy hair,5 / 5,1617
https://www.influenster.com/reviews/aveda-cherry-almond-softening-shampoo,Aveda Cherry Almond Softening Shampoo,"Babassu and coconut derived ingredients deeply, yet gently cleanse hair while maintaining healthy lipids and oils. Naturally derived cherry blossom and sweet almond oil restore softness and shine from roots to ends leaving hair feeling touchably soft and full of weightless bounce.**When used with ch",3 / 5,1601
https://www.influenster.com/reviews/loreal-paris-hair-expertise-color-radiance,L'Oréal Paris Hair Expertise Color Radiance,"FORMULATED WITH UV FILTERS TO TRANSFORM COLOUR-TREATED HAIR The Color Radiance formula with UV filters works on 2 levels: 1. Nourishes the hair and transforms its surface. 2. Protects the fibre from external aggressions, keeping hair shiny and vibrant.   SHAMPOO: A shampoo with UV filters that nourishes coloured hair from root to tip and wraps it with protective care. CONDITIONER: A caring conditioner that helps protect the hair fibre from external aggressions and accentuates  haircolour’s radiance. INSTANT MIRACLE: A rinse-out treatment that provides complete protective care to instantly condition dry, coloured hair and revive its shine.",5 / 5,1604
https://www.influenster.com/reviews/phd-shampoo,Phd Shampoo,Shop Living Proof Phd Shampoo. Enjoy free shipping and free returns plus a free gift and 3 free samples with every purchase at Bluemercury.com.,5 / 5,1587
https://www.influenster.com/reviews/grapefruit-silicone-free-volume-shampoo,Grapefruit Silicone Free Volume Shampoo,"DEEP HAIR NOURISHMENT: Get deeply nourished, weightlessly soft hair with shampoo containing naturally derived camellia oil SUPRISINGLY LIGHTWEIGHT: Camellia oil mimics the hairâ€™s natural oils, so it instantly soaks in VOLUME: Shampoo made with luscious grapefruit provides volume for full and soft hair FREE OF SILICONES, PARABENS, DYES, AND PHTHALATES: Plus, Certified PETA Cruelty-Free REAL, PURE INGREDIENTS: Our plants are certified by the Royal Botanic Gardens, Kew 96% NATURAL ORIGIN INGREDIENTS: Natural source ingredients with limited processing and purified water; after processing, natural source ingredients maintain â‰¥50% of their natural origin material",5 / 5,1579
https://www.influenster.com/reviews/pantene-rose-water-sulfate-free-shampoo,Pantene Rose Water Sulfate Free Shampoo,"View every day through rose-colored glasses. Pantene Pro-V Blends Rose Water Sulfate Free Conditioner helps soothe and rehydrate hair so you can look your best with moisturized, petal soft hair.",5 / 5,1584
https://www.influenster.com/reviews/pantene-pro-v-color-preserve-volume-shampoo,Pantene Pro-V Color Preserve Volume Shampoo,"Fights fade-out. 100% body. Zero weight. Turn up the volume and keep your color loud and clear. Remove buildup without weighing your hair down.  Clinically Proven Healthier Hair with Every Wash* *shampoo and conditioner system vs. non-conditioning shampoo USAGE: WHO: Great for color-treated hair lacking body WHEN: Gentle enough to use daily  HOW: Lather into wet hair; repeat if you want to. Follow with Color Preserve Volume Conditioner for added volume. Ingredients: Water, Sodium Lauryl Sulfate, Sodium Laureth Sulfate, Sodium Chloride, Glycol Distearate, Laureth-4, Sodium Citrate, Sodium Xylenesulfonate, Fragrance, Dimethicone, Citric Acid, Sodium Benzoate, Tetrasodium Edta, Trisodium Ethylenediamine Disuccinate, Polyquaternium-6, Panthenol, Panthenyl Ethyl Ether, Methylchloroisothiazolinone, Methylisothiazolinone",5 / 5,1576
https://www.influenster.com/reviews/dove-nourishing-rituals-cool-moisture-shampoo,Dove Nourishing Rituals Cool Moisture Shampoo,Ease into your day with the soothing fragrance of this Dove shampoo that nourishes and protects your hair from dryness.,5 / 5,1565
https://www.influenster.com/reviews/loreal-paris-shampoo-for-normal-hair,L'Oreal Paris Shampoo for Normal Hair,Shampoo for Normal Hair,5 / 5,1561
https://www.influenster.com/reviews/ogx-beauty-argan-oil-of-morocco-shampoo,Ogx Beauty Argan Oil of Morocco Shampoo,"Lather up with this precious blend containing argan oil of Morocco, to help restore and strengthen your locks to silky perfection. It will help protect your hair from styling, without any sulfates or parabens.",3 / 5,1541
https://www.influenster.com/reviews/aussie-miraculously-smooth-shampoo,Aussie Miraculously Smooth Shampoo,"Is your hair looking a bit rough â€˜nâ€™ ready? Transform it into a seriously silky mane with our Miracle Smooth Shampoo. See ya, frizzy strays, we never liked you anyway.",5 / 5,1537
https://www.influenster.com/reviews/love-beauty-and-planet-sulfate-free-coconut-water-mimosa-flower-shampoo,Love Beauty And Planet sulfate-free coconut water & mimosa flower shampoo,Build bounce into your hair with Love Beauty and Planet® Volume and Bounty Coconut Water & Mimosa Flower Sulfate-Free Shampoo.,2 / 5,1530
