URL,Product Name,Product Description,Average Rating,Total Reviews
https://www.influenster.com/reviews/loreal-paris-brass-toning-purple-sulfate-free-shampoo,L'Oreal Paris Brass Toning Purple Sulfate Free Shampoo,Brass Toning Purple Sulfate Free Shampoo,4 / 5,3801
https://www.influenster.com/reviews/loreal-paris-extraordinary-clay-shampoo,L'Oreal Paris Extraordinary Clay Shampoo,Extraordinary Clay Shampoo,4 / 5,3772
https://www.influenster.com/reviews/no-4-bond-maintenancetm-shampoo,No. 4 Bond Maintenance™ Shampoo,"Which hair type is it good for?✔ Straight✔ Wavy✔ Curly✔ Coiled✔ Tightly CoiledWhat it is:A highly moisturizing, reparative shampoo that leaves hair easy to manage, shiny, and healthier with each use. Key benefits:- Repairs and maintains bonds within the hair - Eliminates frizz and flyaways- Reduces breakageIf you want to know more… This shampoo repairs and protects hair from everyday stresses—including damaged hair, split ends, and frizz—by re-linking broken bonds. No.4 is color-safe and proven to reduce breakage and strengthen all types of hair. This product is an Allure Best of Beauty award winner. Clean at SephoraClean at Sephora is formulated without a list of over 50 ingredients, including sulfates (SLS and SLES), parabens, phthalates, and more. For the full list, check out the Ingredients tab.",5 / 5,3710
https://www.influenster.com/reviews/head-shoulders-dry-scalp-care-with-almond-oil-anti-dandruff-2-in-1,Head & Shoulders Dry Scalp Care with Almond Oil Anti-Dandruff 2-in-1,"Head & Shoulders® Dry Scalp Care 2-In-1 is paraben free Relieves symptoms including flakes, itch, oil and dryness with regular use (*flake and itch associated with dandruff; washes away oil & flakes) Restores the scalp’s natural moisture balance Clinically proven. Up to 100% dandruff protection.** ( **visible flakes, with regular use)",5 / 5,3611
https://www.influenster.com/reviews/garnier-sleek-shine-moroccan-sleek-oil-treatment,Garnier Sleek & Shine Moroccan Sleek Oil Treatment,"Hair oil for instant sleek* *With shampoo, conditioner and leave-in treatment",4 / 5,3562
https://www.influenster.com/reviews/pantene-pro-v-classic-clean-shampoo-201-fl-oz,Pantene Pro-V Classic Clean Shampoo - 20.1 fl oz,"Pantene Pro-V Classic Clean Shampoo gives hair a gentle clean and healthy shine from the very first wash. Suitable for all hair types, Pantene Pro-V Classic Clean Shampoo fuels hair with active Pro-V nutrients, tested by the Swiss Vitamin Institute, to strengthen strands, leaving it beautifully soft and healthy-looking. Pantene Pro-V Classic Clean Shampoo provides balanced nourishment for normal to mixed hair to bring out hair’s natural radiance and shine, without the weight. Free from silicones, mineral oils and colourants, it’ll leave hair free-flowing and easy to manage. For best results, follow up this gentle cleanse with Pantene Pro-V Classic Clean Conditioner and treatments.",5 / 5,3512
https://www.influenster.com/reviews/jamaican-black-castor-oil-bentonite-clay-shampoo-bar,Jamaican Black Castor Oil Bentonite Clay Shampoo Bar,"A completely new experience for hair! This mineral-rich shampoo bar absorbs excess oils and lifts away impurities while providing a gentle cleansing, rich lather. Unique curved edges make direct application to root and scalp easy. Jamaican Black Castor Oil blends with Rhassoul clay to develop this nourishing, natural shampoo bar that provides hydration, softening damaged curls and coils. Leaves hair looking and feeling healthy. Format is ideal for travel.",5 / 5,3303
https://www.influenster.com/reviews/suave-keratin-infusion-dry-shampoo,Suave Keratin Infusion Dry Shampoo,"El refrescante champú seco Suave Professionals® contiene queratina y absorbe los aceites, para limpiar tu cabello y dejarlo fresco, suave y dócil entre lavados.",2 / 5,3228
https://www.influenster.com/reviews/suave-naturals-tropical-coconut-shampoo,Suave® Naturals Tropical Coconut Shampoo,Suave Naturals Tropical Coconut Shampoo: Say yes to beautiful without paying the price With coconut extract and vitamin E Family size,3 / 5,3225
https://www.influenster.com/reviews/pureology-strength-cure-shampoo-55,Pureology Strength Cure Shampoo,"Gentle, concentrated and sulfate free, Strength Cure Shampoo for damaged hair helps fortify micro-scarred color-treated hair and provides a velvety-soft finish, while the soothing blend of lavender, honey, peach and vanilla consume the senses.   How To Use: Apply a quarter-sized amount to wet hair and lather. Rinse. Repeat if necessary. For best results, follow with Strength Cure Condition.   Ingredients: AQUA/WATER/EAU, SODIUM COCOYL ISETHIONATE, SODIUM LAURYL SULFOACETATE, DISODIUM LAURETH SULFOSUCCINATE, SODIUM LAUROYL SARCOSINATE, COCO-BETAINE, GLYCOL DISTEARATE, GLYCERETH-26, DECYL GLUCOSIDE, PARFUM/FRAGRANCE, SODIUM ISETHIONATE, COCONUT ACID, PPG-5-CETETH-20, DIVINYLDIMETHICONE/DIMETHICONE COPOLYMER, POLYQUATERNIUM-7, AMODIMETHICONE, CARBOMER, ACRYLATES COPOLYMER, POLYQUATERNIUM-10, PEG-55 PROPYLENE GLYCOL OLEATE, PROPYLENE GLYCOL, C11-15 PARETH-7, BENZOIC ACID, LAURETH-9, GLYCERIN, TOCOPHEROL, OLEA EUROPAEA OIL/OLIVE FRUIT OIL, CAMELINA SATIVA OIL/CAMELINA SATIVA SEED OIL, TRIDECETH-12, HELIANTHUS ANNUUS SEED EXTRACT/SUNFLOWER SEED EXTRACT, SODIUM BENZOATE, C12-13 PARETH-23, BENZYL ALCOHOL, COUMARIN, GERANIOL, C12-13 PARETH-3, HYDROLYZED VEGETABLE PROTEIN PG-PROPYL SILANETRIOL, ARGININE, 2-OLEAMIDO-1,3-OCTADECANEDIOL, POLY(LINSEED OIL), BENZOPHENONE-4, CI 14700/RED 4, METHYLCHLOROISOTHIAZOLINONE, HAEMATOCOCCUS PLUVIALIS/ HAEMATOCOCCUS PLUVIALIS EXTRACT, METHYLISOTHIAZOLINONE, CAPRYLIC/CAPRIC TRIGLYCERIDE, MELANIN, CI 15510/ORANGE 4, Astaxanthin, ROSMARINUS OFFICINALIS LEAF EXTRACT/ROSEMARY LEAF EXTRACT, SODIUM HYDROXIDE, CITRIC ACID",5 / 5,3158
https://www.influenster.com/reviews/tresemme-moisture-rich-shampoo-conditioner-value-pack,TRESemme Moisture Rich Shampoo & Conditioner Value Pack,"Uniquely formulated with vitamin E and natural extracts of sunflower, TRESemme Moisture Rich Shampoo & Conditioner system delivers salon-style hair at an affordable price. The formula delivers optimized hydration that targets dryness and locks in moisture where your hair needs it most. Created for daily use, this advanced moisturizing system with vitamin E helps restore vibrancy and makes dry, damaged hair soft without weighing it down. Formula is designed for optimized hydration; Used by professional hairdressers at salons; Ensures soft, shiny, healthy-looking hair; Includes shampoo and conditioner (40 oz.)",4 / 5,3229
https://www.influenster.com/reviews/suave-professionals-almond-shea-butter-moisturizing-shampoo-126-fl-oz,Suave Professionals Almond & Shea Butter Moisturizing Shampoo - 12.6 fl oz,"Obtén más información sobre nuestro champú humectante Almond + Shea Butter Moisturizing Shampoo, que reconstituye a medida que limpia, dejando tu cabello nutrido y hermoso.",5 / 5,3096
https://www.influenster.com/reviews/head-shoulders-paraben-free-dry-scalp-care-shampoo,Head & Shoulders Paraben Free Dry Scalp Care Shampoo,"- Head & Shoulders® Dry Scalp Care Shampoo is paraben free - America’s #1 dermatologist-recommended dandruff shampoo (*based on volume sales) - Relieves symptoms including flakes, itch, oil and dryness with regular use (*flake and itch associated with dandruff; washes away oil & flakes) Detailed information on Head & Shoulders ingredients",4 / 5,3079
https://www.influenster.com/reviews/suave-professionals-rosemary-mint-shampoo-126-fl-oz,Suave Professionals Rosemary + Mint Shampoo - 12.6 fl oz,"Descubre cómo nuestro champú tonificante Rosemary Mint Shampoo limpia suavemente y aumenta la docilidad del cabello, dejándolo suave y brillante.",5 / 5,3039
https://www.influenster.com/reviews/pantene-curl-perfection-shampoo,Pantene Curl Perfection Shampoo,"24HR Definition and Moisture. Get the gentle cleansing and nourishment your natural curls need with Pantene Pro-V Curl Perfection Shampoo. This moisturizing shampoo for curly hair is infused with a Frizz Calming Complex which helps smooth cuticle edges to define curls and control frizz, even allowing you to air dry your way to your perfect curls. It leaves hair bouncy, manageable, shiny and feeling moisturized",5 / 5,3049
https://www.influenster.com/reviews/loreal-paris-elvive-extraordinary-oil-shampoo,L'Oréal Paris Elvive Extraordinary Oil Shampoo,"For dry, lifeless hair. Eliminates dryness in just 1 wash.* Deep nourishment without the weight. L'Oréal Paris Extraordinary Oil Shampoo hydrates and nourishes to transform dry, lifeless hair to soft and lustrous in just one wash with our Expert Extraordinary hair oil system. Hair is sumptuously soft, lightweight, and brilliantly shiny. For best results, use L'Oréal Paris Extraordinary Oil shampoo and conditioner together. When using the complete system of shampoo, conditioner and treatment Packaging may vary. L'Oreal Paris Hair Expert is now L'Oreal Paris Elvive. New look, same amazing formula. Ingredients: Aqua / Water / EAU Sodium Laureth Sulfate Coco-betaine Laureth-5 Carboxylic Acid Cocamide Mipa Sodium Chloride Isostearyl Neopentanoate Parfum / Fragrance Polyquaternium-10 Amodimethicone Sodium Benzoate Hexylene Glycol PEG-55 Propylene Glycol Oleate Propylene Glycol PEG-60 Hydrogenated Castor Oil Salicylic Acid Caprylic/Capric Triglyceride Sodium Hydroxide Arginine",5 / 5,2960
https://www.influenster.com/reviews/briogeo-scalp-revivaltm-charcoal-coconut-oil-micro-exfoliating-shampoo-scalp-scrub,Briogeo Scalp Revival™ Charcoal + Coconut Oil Micro-Exfoliating Shampoo | Scalp Scrub,"WARNING: This product is for Recharge Subscriptions use only, do not publish or delete this product. Customers will not see this message.",5 / 5,2923
https://www.influenster.com/reviews/herbal-essences-totally-twisted-conditioner-117-fl-oz,Herbal Essences Totally Twisted Conditioner - 11.7 fl oz,"Itâ€™s all about those curls, girls! Herbal Essences Totally Twisted shampoo is specially formulated to help define your curls. And itâ€™s a great frizz fighter. Its moisture-rich formula helps to protects your hair from humidity all day. Hereâ€™s one more twist â€“ youâ€™re going to love its juicy, berry-fresh scent. It is paraben free, mineral oil free, dermatologist tested and certified cruelty free by PETA. Pairs well with Herbal Essences Totally Twisted Conditioner. And it comes to you in a 100% recyclable bottle*. Check out our fan favorite Herbal Essences Totally-Twisted Mousse for weightless, touchable curls! *excluding cap DEFINE CURLS: Specially formulated to help define curls while being color safe & pH balanced. FRIZZ FIGHTER: Helps to Protect hair against humidity all day DERMATOLOGIST TESTED: This shampoo & body wash was tested by experts to be safe on skin so you can enjoy the same great scent on your hair and body wash! REVEL IN LUSH AROMAS: Juicy notes of wild berry essences PAIRS WITH: Herbal Essences Totally Twisted Conditioner and our fan favorite Herbal Essences Totally Twisted Mousse!",5 / 5,2887
https://www.influenster.com/reviews/herbal-essences-color-me-happy-shampoo-for-color-treated-hair,Herbal Essences Color Me Happy Shampoo For Color Treated Hair,"Herbal Essences Color Me Happy shampoo for colored hair has a romantic Moroccan rose scent and a color-protecting formula to help your hair feel radiant, fresh, and irresistible. It replenishes softness and enhances shine to help keep your color looking fresh. Herbal Essences Color Me Happy Shampoo for Color-Treated Hair has 0% parabens, silicones, gluten or mineral oil Luxurious notes of rose essences Offers color care for touchable, radiant hair Gentle enough for daily use, color-safe and pH-balanced Ingredients: Water, Sodium Laureth Sulfate, Sodium Lauryl Sulfate, Cocamidopropyl Betaine, Citric Acid, Passiflora Incarnata Flower Extract, Zea Mays (Corn) Silk Extract, Rosa Centifolia Flower Extract, Fragrance, Sodium Citrate, Sodium Xylenesulfonate, Cocamide MEA, Sodium Chloride, Sodium Benzoate, Tetrasodium EDTA, Guar Hydroxypropyltrimonium Chloride, Linoleamidopropyl PG Dimonium Chloride Phosphate, Methylchloroisothiazolinone, Methylisothiazolinone, Red 33, Red 4, Yellow 10",5 / 5,2886
https://www.influenster.com/reviews/redken-color-extend-blondage-color-depositing-purple-shampoo-62,Redken Color Extend Blondage Color Depositing Purple Shampoo,"<!--td {border: 1px solid #ccc;}br {mso-data-placement:same-cell;}--> Color Extend Blonde Conditioner has ultra violet pigment and Triple Acid Protein complex to tone, strengthen and brighten all in one for a brighter*, stronger** blonde. The light purple conditioner helps detangle and smooth processed blonde hair or to condition natural blonde while keeping your color protected and bright. AWARD: 2019 Allure Best of Beauty best conditioner for color treated hair",5 / 5,2889
https://www.influenster.com/reviews/pantene-pro-v-ultimate-10-shampoo,Pantene Pro-V Ultimate 10 Shampoo,"10 in 1 multi-tasker that repairs, smooths, boosts shine & more: 1)     Repair for Rough Hair 2)     Strength Against Damage 3)     Silky Softness 4)     Brilliant Shine 5)     Smoothing 6)     Moisture 7)     Frizz Control 8)     Heat Protection 9)     Manageability 10)     Tamed Flyaways Clinically Proven Healthier Hair with Every Wash* *shampoo and conditioner system vs. non-conditioning shampoo USAGE: WHO: Great for all hair types that are prone to manageability concerns.  Formula infuses hair with needed moisture. WHEN: Daily to give hair a dose of nourishment. HOW: Lather into wet hair; repeat if you want to. Follow with Ultimate 10 Conditioner and BB Crème before styling. Ingredients: Water, Sodium Lauryl Sulfate, Sodium Laureth Sulfate, Cocamidopropyl Betaine, Glycol Distearate, Dimethicone, Sodium Citrate, Cocamide Mea, Sodium Xylenesulfonate, Fragrance, Citric Acid, Sodium Benzoate, Polyquaternium-76, Sodium Chloride, Tetrasodium Edta, Trisodium Ethylenediamine Disuccinate, Panthenol, Panthenyl Ethyl Ether, Methylchloroisothiazolinone, Methylisothiazolinone",5 / 5,2871
https://www.influenster.com/reviews/carols-daughter-wash-day-delight-sulfate-free-shampoo-for-curly-hair,Carol's Daughter Wash Day Delight Sulfate Free Shampoo For Curly Hair,"Carol's Daughter Wash Day Delight Micellar shampoo with Aloe for hair transforms from a water to a gentle foam lather for a deep clean quickly without stripping or harsh friction to help cut down time on wash day. Perfect for curly hair and coily hair, our targeted applicator helps the liquid formula instantly flow through hair providing easy scalp access and quickly rinses clean. Sulfate free shampoo transforms from a liquid into a gentle foam lather without harsh friction and effortlessly works throughout, minimizing tangles. Sulfate free shampoo for curly hair with Micellar Water acts like a magnet to attract and lift away buildup for a thorough hair and scalp cleanse without stripping hair. The Wash Day Delight Recipe - 98 percent naturally derived ingredients, blended with Aloe for hair - sulfate free, silicone free, paraben free, no artificial colors, vegan formula - see disclaimer. Cleanses Hair Quickly Reduces Time to Detangle Hair Doesn't Strip Hair",5 / 5,2861
https://www.influenster.com/reviews/ogx-extra-strength-hydrate-repair-argan-oil-of-morocco-shampoo,OGX Extra Strength Hydrate + Repair Argan Oil of Morocco Shampoo,"Indulge your hair with this creamy lather, made with repairing silk proteins and hydrating argan oil. It will help restore your hair while locking in intense moisture to create silky, perfect strands. HOW TO USE Apply shampoo generously to wet hair, massage into a lather through to ends, then rinse the hair thoroughly. After shampooing, follow with conditioner. Warning: Avoid contact with eyes. If contact occurs rinse immediately. For best results use in conjunction with other INGREDIENTS Water (Aqua), Sodium C14-16 Olefin Sulfonate, Cocamidopropyl Betaine, Glycol Distearate, PPG-2 Hydroxyethyl Coco/Isostearamide, Argania Spinosa (Argan) Kernel Oil, Silk Amino Acids, Dimethicone, Amodimethicone, Glycerin, Cocamidopropyl Hydroxysultaine, Guar Hydroxypropyltrimonium Chloride, Sodium Cocoyl Isethionate, Cetrimonium Chloride, Laureth-4, Laureth-23, Polyquaternium-6, Polyquaternium-10, PEG-120 Methyl Glucose Dioleate, Methyl Gluceth-10, Trideceth-12, Sodium Chloride, Citric Acid, DMDM Hydantoin, Diazolidinyl Urea, Iodopropynyl Butylcarbamate, Fragrance (Parfum), Red 40, (CI 16035), Yellow 5 (CI 19140). While we strive to keep ingredient lists on this website as accurate as possible, we cannot guarantee that these lists are complete, reliable, and up-to-date. Please refer to the ingredients list on the product packaging for the most accurate list of ingredients.",4 / 5,2850
https://www.influenster.com/reviews/head-shoulders-instant-oil-control-2-in-1,Head & Shoulders Instant Oil Control 2-in-1,"- Head & Shoulders Instant Oil Control Anti-Dandruff 2 in 1 removes oil to leave your scalp clean and refreshed. - Multi-symptom relief offers proven protection from flakes, itch* and dryness. (*flakes and itch associated with dandruff) - Convenient 2 in 1 formula controls hair and scalp oils while cleansing and hydrating. - Bright mango and citrus essences leave hair smelling fresh and clean. - Clinically proven. Up to 100% dandruff protection.** ( **visible flakes, with regular use) Detailed information on Head & Shoulders ingredients",5 / 5,2845
https://www.influenster.com/reviews/garnier-smoothing-shampoo-with-coconut-oil-cocoa-butter-extracts-54,Garnier Smoothing Shampoo with Coconut Oil & Cocoa Butter Extracts,Smoothing shampoo tames & controls frizzy hair,4 / 5,2815
https://www.influenster.com/reviews/redken-color-extend-shampoo,Redken Color Extend Shampoo,An award-winning shampoo for color treated hair that maximizes color vibrancy while strengthening hair with daily shampooing. This shampoo makes haircolor last longer and will protect it from harsh environmental conditions. Gently cleanses and strengthens Repels UVA/UVB rays and other environmental aggressors and provides anti-fade protection to optimize color durability and retention Keeps haircolor radiant with mirror-like shine AWARDS: 2015 New Beauty Choice Award 2014 Readers' Choice Shampoo for Color-Treated Hair,5 / 5,2777
https://www.influenster.com/reviews/biolage-ultra-hydrasource-shampoo-for-dry-hair,Biolage Ultra HydraSource Shampoo for Dry Hair,"Inspired by the aloe plant that never seems to dry, Biolage Professional Hydra Source Shampoo helps optimize moisture balance for healthy looking hair. Provides 72 hours of intense moisture & frizz control.",5 / 5,2763
https://www.influenster.com/reviews/garnier-nourishing-treat-1-minute-hair-mask-coconut-extract,Garnier Nourishing Treat 1 Minute Hair Mask + Coconut Extract,"For Dry Hair Nourishing Treat 1 Minute Hair Mask + Coconut Extract helps you get soft, smooth & manageable hair.",5 / 5,2778
https://www.influenster.com/reviews/biolage-colorlast-shampoo,Biolage ColorLast Shampoo,"Color-treated hair can fade and lose its luster over time. Inspired by nature's fade-defying orchid, Biolage COLORLAST Shampoo helps maintain the color depth, tone and shine for vivid color-treated hair. Give her hair salon-vibrant color for up to 9 weeks*. *When using the system of COLORLAST shampoo and conditioner vs. a non-conditioning shampoo.",5 / 5,2753
https://www.influenster.com/reviews/suave-moroccan-infusion-shine-shampoo-96,Suave Moroccan Infusion Shine Shampoo,Ve cómo nuestro champú Moroccan Infusion Shine Shampoo le brinda a tu cabello un brillo visible.,5 / 5,2749
https://www.influenster.com/reviews/pantene-sheer-volume-shampoo-28,Pantene Sheer Volume Shampoo,Sheer Volume Shampoo,5 / 5,2705
https://www.influenster.com/reviews/herbal-essences-body-envy-volumizing-shampoo-338-fl-oz,Herbal Essences Body Envy Volumizing Shampoo - 33.8 fl oz,"Herbal Essences Body Envy volumizing shampoo’s bright citrusy scent and formula free from heavy buildup will help you feel uplifted. It leaves a lift in all the right places and rinses clean to leave you with lots of bounce for the ounce. Herbal Essences Body Envy Volumizing Shampoo has no parabens, silicones, gluten or mineral oil Bright notes of citrus Lightweight formula cleanses to deliver body and bounce to fine hair Lifts hair with no heavy buildup Gentle enough for daily use, color-safe and pH-balanced INGREDIENTS: Water/Eau, Sodium Lauryl Sulfate, Sodium Laureth Sulfate, Cocamidopropyl Betaine, Zea Mays (Corn) Silk Extract, Pearl Extract, Passiflora Laurifolia Flower Extract, Passiflora Quadrangularis Flower Extract, Passiflora Incarnata Flower Extract, Sodium Citrate, Sodium Xylenesulfonate, Fragrance/parfum, Sodium Chloride, Citric Acid, Sodium Benzoate, Hydroxypropyl Methylcellulose, Tetrasodium Edta, Methylchloroisothiazolinone, Methylisothiazolinone, Yellow 5, Yellow 10.",5 / 5,2670
https://www.influenster.com/reviews/tresemme-flawless-curls-shampoo-with-coconut-oil,Tresemme Flawless Curls Shampoo with Coconut Oil,"""For manageable and gorgeous curls and waves, salon-quality TRESemmé Flawless Curls Shampoo with Pro Style Technology™ for curly hair nourishes and strengthens to detangle hair and tame frizz. This curl shampoo with coconut oil, created specifically for curly hair, provides maximum hydration by targeting dryness and boosting moisture. Free from Parabens, Mineral Oils, and DMDM Hydantoin. TRESemmé is proud to be a hair care brand approved by PETA (People for the Ethical Treatment of Animals).",5 / 5,2676
https://www.influenster.com/reviews/dove-nutritive-solutions-anti-frizz-oil-therapy-shampoo,Dove Nutritive Solutions Anti-Frizz Oil Therapy Shampoo,"With a blend of Nutri-Oils, this moisturizing system controls frizz and deeply nourishes your hair for 100% smoothness.",4 / 5,2651
https://www.influenster.com/reviews/repair-protect-7-shampoo,Repair & Protect 7 Shampoo,"Formulado con biotina, el sistema Repair & Protect 7 se encarga al instante del daño visible y ayuda a reparar la fibra capilar desde adentro. El resultado: cabello visiblemente más fuerte, sano y manejable, listo para el peinado.",5 / 5,2634
https://www.influenster.com/reviews/not-your-mothers-way-to-grow-long-strong-shampoo-19,Not Your Mother's® Way To Grow Long & Strong Shampoo,"Remember the princess in the tower with the long, golden locks? Well, now you can let down your own hair because of Way to Grow. Made with essential vitamins, herbs and bioactive extracts, this salon formula will have your hair stronger, healthier and in turn, longer by the time prince charming comes for you!",4 / 5,2578
https://www.influenster.com/reviews/moroccanoil-hydrating-shampoo-250ml-94,Moroccanoil Hydrating Shampoo 250mL,Moroccanoil Hydrating Shampoo 250mL,4 / 5,2547
https://www.influenster.com/reviews/loreal-paris-extraordinary-oil-more-than-shampoo,L'Oreal Paris Extraordinary Oil More Than Shampoo,"Cleanses like a shampoo, cares like a mask. A shampoo with a mask-like texture ultra-concentrated in nutritive lipids. They assimilate instantly into the dry parts of the fibre for targeted care that remains, even when rinsed. Dry hair is lastingly cleansed and intensely nourished with no weigh-down.",5 / 5,2506
https://www.influenster.com/reviews/aussie-mega-moist-2-in-1-shampoo-conditioner,Aussie Mega Moist 2-in-1 Shampoo + Conditioner,Perfect for dry hair in need of hydration. Itâ€™s also great for all hair types. â€¢ Moisturize â€¢ Strengthen â€¢ Soften,3 / 5,2503
https://www.influenster.com/reviews/raw-shea-butter-moisture-retention-shampoo,Raw Shea Butter Moisture Retention Shampoo,Moisturize & Cleanse,5 / 5,2472
https://www.influenster.com/reviews/aussie-aussome-volume-shampoo,Aussie Aussome Volume Shampoo,"Perfect for flat hair in need of a lift. It’s also great for all hair types. • Boost  • Lift  • Moisturize If you’re ready to take your hair to new heights this volumizing shampoo is the one for you.  With a touch of Australian Aloe, this big body volumizing shampoo formula is sure to add some oomph to your ‘do. Directions: This shampoo is a big deal. Work through wet hair, rinse and follow with Aussome Volume Conditioner for hugely aussome results. Ingredients: Water/Eau, Sodium Lauryl Sulfate, Sodium Laureth Sulfate, Cocamidoproyl Betaine, Fragrance/Parfum, Sodium Citrate, Sodium Xylenesulfonate, Sodium Chloride, Citric Acid, Sodium Benzote, Hydroxypropyl Methylcellulose, Tetrasodium Edta, Aloe Barbadensis Leaf extract, Ecklonia Radiata Extract, Simmondsia Chinensis (Jojoba) Seed Oil, Methylchloroisothiazolinone, Methylisothiazolinone, Yellow 5, Red 33",5 / 5,2423
https://www.influenster.com/reviews/aussie-total-miracle-7n1-shampoo,Aussie Total Miracle 7N1 Shampoo,Perfect for dry or damaged hair in need of a totally miraculous overhaul. â€¢ Moisturize â€¢ Control Frizz â€¢ Smooth,5 / 5,2415
